{
  "version": "2.0.0",
  "client_id": "SKY_TV_NZ",
  "name": "Sky TV NZ - Main Sales Pitch v2",
  "description": "Enhanced outbound sales script with BANT qualification, comprehensive objection handling, and compliance-first approach",
  "variables": [
    "customer_name",
    "agent_name",
    "current_plan",
    "fav_sport",
    "fav_team",
    "callback_date",
    "callback_time",
    "partner_name"
  ],
  "nodes": [
    {
      "id": "greeting_01",
      "type": "SCRIPT",
      "config": {
        "text": "Hi {{customer_name}}, this is {{agent_name}} calling from Sky TV New Zealand. How are you doing today?",
        "keywords": ["hi", "hello", "sky tv", "calling"],
        "wait_for_response": true,
        "display_notes": "SA AGENTS: Warm, friendly tone. Slow down your natural pace for NZ customers. Pronounce 'Sky' clearly."
      },
      "transitions": [
        {
          "trigger_type": "KEYWORD",
          "value": ["good", "fine", "well", "great", "alright"],
          "next_node": "compliance_recording_01",
          "confidence_threshold": 0.6
        },
        {
          "trigger_type": "KEYWORD",
          "value": ["not interested", "no thanks", "remove me", "don't call"],
          "next_node": "objection_not_interested_01",
          "confidence_threshold": 0.7
        },
        {
          "trigger_type": "KEYWORD",
          "value": ["busy", "no time", "bad time", "can't talk"],
          "next_node": "objection_busy_01",
          "confidence_threshold": 0.7
        },
        {
          "trigger_type": "KEYWORD",
          "value": ["had sky", "cancelled sky", "had it before"],
          "next_node": "objection_had_sky_before_01",
          "confidence_threshold": 0.7
        },
        {
          "trigger_type": "INTENT",
          "value": "Positive",
          "next_node": "compliance_recording_01",
          "confidence_threshold": 0.6
        }
      ]
    },
    {
      "id": "compliance_recording_01",
      "type": "COMPLIANCE",
      "config": {
        "text": "Great! Before we continue, I need to let you know this call is being recorded for quality and training purposes. Are you okay with that?",
        "keywords": ["recording", "consent", "quality", "training"],
        "verbatim_match": 0.95,
        "on_skip": "WARNING",
        "alert_message": "COMPLIANCE: Recording consent is MANDATORY in NZ before proceeding",
        "wait_for_response": true,
        "display_notes": "CRITICAL: MUST get verbal consent. NZ Privacy Act requirement. Do not skip."
      },
      "transitions": [
        {
          "trigger_type": "KEYWORD",
          "value": ["yes", "sure", "okay", "fine", "no problem", "go ahead"],
          "next_node": "needs_discovery_intro",
          "confidence_threshold": 0.8
        },
        {
          "trigger_type": "KEYWORD",
          "value": ["no", "don't want", "not okay", "prefer not"],
          "next_node": "compliance_decline_01",
          "confidence_threshold": 0.8
        }
      ]
    },
    {
      "id": "compliance_decline_01",
      "type": "SCRIPT",
      "config": {
        "text": "I completely understand. Unfortunately, I can't proceed without recording consent as it's a regulatory requirement. Would you prefer I call you back at a better time when you're comfortable with it?",
        "keywords": ["can't proceed", "regulatory", "call back"],
        "wait_for_response": true,
        "display_notes": "Recording consent declined. Offer callback option."
      },
      "transitions": [
        {
          "trigger_type": "KEYWORD",
          "value": ["yes", "sure", "call back", "later"],
          "next_node": "callback_schedule_01",
          "confidence_threshold": 0.7
        },
        {
          "trigger_type": "KEYWORD",
          "value": ["no", "not interested", "don't call"],
          "next_node": "polite_close_01",
          "confidence_threshold": 0.7
        }
      ]
    },
    {
      "id": "needs_discovery_intro",
      "type": "SCRIPT",
      "config": {
        "text": "Perfect, thanks {{customer_name}}. I'm reaching out because we have some exciting packages right now with premium sports and entertainment. Quick question - are you currently watching any sports?",
        "keywords": ["sports", "packages", "entertainment", "watching"],
        "wait_for_response": true,
        "display_notes": "Start NEED qualification. Listen for: rugby, cricket, football, netball, basketball."
      },
      "transitions": [
        {
          "trigger_type": "KEYWORD",
          "value": ["rugby", "all blacks", "super rugby", "crusaders", "blues", "highlanders"],
          "next_node": "sport_pitch_rugby",
          "confidence_threshold": 0.6
        },
        {
          "trigger_type": "KEYWORD",
          "value": ["cricket", "black caps", "test match"],
          "next_node": "sport_pitch_cricket",
          "confidence_threshold": 0.6
        },
        {
          "trigger_type": "KEYWORD",
          "value": ["football", "soccer", "premier league", "champions league"],
          "next_node": "sport_pitch_football",
          "confidence_threshold": 0.6
        },
        {
          "trigger_type": "KEYWORD",
          "value": ["no", "not really", "don't watch", "not into sports"],
          "next_node": "movies_pitch_01",
          "confidence_threshold": 0.6
        },
        {
          "trigger_type": "KEYWORD",
          "value": ["netflix", "streaming", "already have"],
          "next_node": "objection_already_streaming_01",
          "confidence_threshold": 0.7
        },
        {
          "trigger_type": "KEYWORD",
          "value": ["contract", "locked in", "in a contract", "committed"],
          "next_node": "objection_in_contract_01",
          "confidence_threshold": 0.7
        },
        {
          "trigger_type": "KEYWORD",
          "value": ["had sky", "cancelled", "had it before", "used to have"],
          "next_node": "objection_had_sky_before_01",
          "confidence_threshold": 0.7
        },
        {
          "trigger_type": "INTENT",
          "value": "Positive",
          "next_node": "sport_pitch_generic",
          "confidence_threshold": 0.6
        }
      ]
    },
    {
      "id": "sport_pitch_rugby",
      "type": "SCRIPT_AND_WIDGET",
      "config": {
        "text": "Fantastic! Rugby fans absolutely love our Sport package. You get every All Blacks match, all Super Rugby games, and exclusive behind-the-scenes content you can't get anywhere else. Let me show you what's included.",
        "widget": "package_calculator",
        "keywords": ["all blacks", "super rugby", "sport package", "exclusive"],
        "auto_trigger": {
          "listen_for": ["rugby", "all blacks", "super rugby"],
          "action": "enable_sport_package"
        },
        "display_notes": "Widget auto-enables Sport package. Emphasize exclusivity (not on streaming)."
      },
      "transitions": [
        {
          "trigger_type": "KEYWORD",
          "value": ["sounds good", "interested", "yes", "sure", "tell me more"],
          "next_node": "bundle_upsell_sport",
          "confidence_threshold": 0.6
        },
        {
          "trigger_type": "KEYWORD",
          "value": ["expensive", "cost", "price", "how much"],
          "next_node": "price_reveal_01",
          "confidence_threshold": 0.7
        },
        {
          "trigger_type": "KEYWORD",
          "value": ["think about it", "not sure", "maybe later"],
          "next_node": "objection_timing_01",
          "confidence_threshold": 0.7
        }
      ]
    },
    {
      "id": "sport_pitch_cricket",
      "type": "SCRIPT_AND_WIDGET",
      "config": {
        "text": "Excellent! Cricket season is massive right now. Our Sport package gives you every Black Caps match - tests, ODIs, T20s - plus IPL, The Ashes, and all the big tournaments. Let me show you the details.",
        "widget": "package_calculator",
        "keywords": ["black caps", "cricket", "sport package", "ipl"],
        "auto_trigger": {
          "listen_for": ["cricket", "black caps"],
          "action": "enable_sport_package"
        },
        "display_notes": "Widget auto-enables Sport package. Cricket is huge in NZ - emphasize comprehensive coverage."
      },
      "transitions": [
        {
          "trigger_type": "KEYWORD",
          "value": ["sounds good", "interested", "yes", "sure", "tell me more"],
          "next_node": "bundle_upsell_sport",
          "confidence_threshold": 0.6
        },
        {
          "trigger_type": "KEYWORD",
          "value": ["expensive", "cost", "price", "how much"],
          "next_node": "price_reveal_01",
          "confidence_threshold": 0.7
        },
        {
          "trigger_type": "KEYWORD",
          "value": ["think about it", "not sure", "maybe later"],
          "next_node": "objection_timing_01",
          "confidence_threshold": 0.7
        }
      ]
    },
    {
      "id": "sport_pitch_football",
      "type": "SCRIPT_AND_WIDGET",
      "config": {
        "text": "Perfect! We've got Premier League, La Liga, Champions League, Europa League - basically every major football competition. Our Sport package is a must-have for football fans in New Zealand.",
        "widget": "package_calculator",
        "keywords": ["premier league", "football", "sport package", "champions league"],
        "auto_trigger": {
          "listen_for": ["football", "soccer", "premier league"],
          "action": "enable_sport_package"
        },
        "display_notes": "Widget auto-enables Sport package. Football fans are passionate - emphasize breadth."
      },
      "transitions": [
        {
          "trigger_type": "KEYWORD",
          "value": ["sounds good", "interested", "yes", "sure", "tell me more"],
          "next_node": "bundle_upsell_sport",
          "confidence_threshold": 0.6
        },
        {
          "trigger_type": "KEYWORD",